{
  "request_id": "req_pay_0001",
  "timestamp": "2026-02-04T16:10:00Z",
  "environment": "sandbox",
  "intent_summary": "Process a payment (simulation request).",
  "target": "payment:invoice_7788",
  "requested_mode": "simulate",
  "action_class_hint": "pay",
  "data_sensitivity_hint": "secret",
  "notes": "Payments are critical; expected deny without human approvals."
}
