{
  "request_id": "req_delete_0001",
  "timestamp": "2026-02-04T16:05:00Z",
  "environment": "sandbox",
  "intent_summary": "Delete an existing record (simulation request).",
  "target": "crm_record:12345",
  "requested_mode": "simulate",
  "action_class_hint": "delete",
  "data_sensitivity_hint": "confidential",
  "notes": "Deletion is high risk; expected deny."
}
